{
  "schemaVersion": "0.1.0",
  "projectId": "fp-101",
  "layoutRevisionId": "layout_fp101_truth_r1",
  "sourceLayoutHash": "642a3454752365059b4ec98695326e86ce1d68b52d2ca251f421a687b58dfa4a",
  "rooms": [
    {
      "id": "room_001",
      "name": "卧室",
      "type": "bedroom",
      "polygon": [
        {
          "x": 2942.995,
          "y": 3256.016
        },
        {
          "x": 6826.193,
          "y": 3256.016
        },
        {
          "x": 6826.193,
          "y": 8366.018
        },
        {
          "x": 5672.213,
          "y": 8366.018
        },
        {
          "x": 5672.213,
          "y": 6875.955
        },
        {
          "x": 3608.447,
          "y": 6875.955
        },
        {
          "x": 3608.447,
          "y": 4033.423
        },
        {
          "x": 2942.995,
          "y": 4033.423
        }
      ],
      "areaMm2": 13884874.181,
      "confidence": 1.0
    },
    {
      "id": "room_002",
      "name": "卧室",
      "type": "bedroom",
      "polygon": [
        {
          "x": 6826.193,
          "y": 3256.016
        },
        {
          "x": 9441.898,
          "y": 3256.016
        },
        {
          "x": 9441.898,
          "y": 7159.439
        },
        {
          "x": 6826.193,
          "y": 7159.439
        }
      ],
      "areaMm2": 10210203.058,
      "confidence": 1.0
    },
    {
      "id": "room_003",
      "name": "阳台",
      "type": "balcony",
      "polygon": [
        {
          "x": 9441.898,
          "y": 2373.19
        },
        {
          "x": 9441.898,
          "y": 3859.316
        },
        {
          "x": 13009.216,
          "y": 3859.316
        },
        {
          "x": 13009.216,
          "y": 2373.19
        }
      ],
      "areaMm2": 5301484.03,
      "confidence": 1.0
    },
    {
      "id": "room_004",
      "name": "客餐厅",
      "type": "livingDining",
      "polygon": [
        {
          "x": 6826.193,
          "y": 7159.439
        },
        {
          "x": 9441.898,
          "y": 7159.439
        },
        {
          "x": 9441.898,
          "y": 3859.316
        },
        {
          "x": 13009.216,
          "y": 3859.316
        },
        {
          "x": 13009.216,
          "y": 11091.18
        },
        {
          "x": 9441.898,
          "y": 11091.18
        },
        {
          "x": 9441.898,
          "y": 8366.018
        },
        {
          "x": 6826.193,
          "y": 8366.018
        }
      ],
      "areaMm2": 28954413.344,
      "confidence": 1.0
    },
    {
      "id": "room_005",
      "name": "卧室",
      "type": "bedroom",
      "polygon": [
        {
          "x": 3837.972,
          "y": 8366.018
        },
        {
          "x": 3837.972,
          "y": 11091.18
        },
        {
          "x": 7911.365,
          "y": 11091.18
        },
        {
          "x": 7911.365,
          "y": 8366.018
        }
      ],
      "areaMm2": 11100655.815,
      "confidence": 1.0
    },
    {
      "id": "room_006",
      "name": "卫生间",
      "type": "bathroom",
      "polygon": [
        {
          "x": 7911.365,
          "y": 8366.018
        },
        {
          "x": 7911.365,
          "y": 11091.18
        },
        {
          "x": 9441.898,
          "y": 11091.18
        },
        {
          "x": 9441.898,
          "y": 8366.018
        }
      ],
      "areaMm2": 4170950.371,
      "confidence": 1.0
    },
    {
      "id": "room_007",
      "name": "其他",
      "type": "other",
      "polygon": [
        {
          "x": 7344.398,
          "y": 11091.18
        },
        {
          "x": 7344.398,
          "y": 13625.946
        },
        {
          "x": 10848.325,
          "y": 13625.946
        },
        {
          "x": 10848.325,
          "y": 11091.18
        }
      ],
      "areaMm2": 8881635.026,
      "confidence": 1.0
    },
    {
      "id": "room_008",
      "name": "厨房",
      "type": "kitchen",
      "polygon": [
        {
          "x": 10848.325,
          "y": 11091.18
        },
        {
          "x": 10848.325,
          "y": 13625.946
        },
        {
          "x": 13009.216,
          "y": 13625.946
        },
        {
          "x": 13009.216,
          "y": 11091.18
        }
      ],
      "areaMm2": 5477353.037,
      "confidence": 1.0
    },
    {
      "id": "room_009",
      "name": "卫生间",
      "type": "bathroom",
      "polygon": [
        {
          "x": 2942.995,
          "y": 6552.002
        },
        {
          "x": 2942.995,
          "y": 8366.018
        },
        {
          "x": 5672.213,
          "y": 8366.018
        },
        {
          "x": 5672.213,
          "y": 6875.955
        },
        {
          "x": 3608.447,
          "y": 6875.955
        },
        {
          "x": 3608.447,
          "y": 6552.002
        }
      ],
      "areaMm2": 4282281.932,
      "confidence": 1.0
    }
  ],
  "contentHash": "399fe464d6d1b21c0d06c8d3275eb9ad8e4a08b5d5344d05d59600263ccc8fb7"
}