{
  "schemaVersion": "0.1.0",
  "projectId": "p0-00-three-v1",
  "layoutRevisionId": "p0_00_three_layout_r1",
  "sourceLayoutHash": "ebeb855a1b85980aedce48c4b1e3deeb93e1f186ad5f063cdb08d844dac5cb71",
  "rooms": [
    {
      "id": "vlm_room_006",
      "name": "客餐厅",
      "type": "livingDining",
      "polygon": [
        {
          "x": 9790.170772268399,
          "y": 3969.055279683273
        },
        {
          "x": 13495.119119490479,
          "y": 3969.055279683273
        },
        {
          "x": 13495.119119490479,
          "y": 11508.10771539372
        },
        {
          "x": 9790.170772268399,
          "y": 11508.10771539372
        },
        {
          "x": 9790.170772268399,
          "y": 8693.174892923314
        },
        {
          "x": 7078.728127094699,
          "y": 8693.174892923314
        },
        {
          "x": 7078.728127094699,
          "y": 7275.35946395844
        },
        {
          "x": 9790.170772268399,
          "y": 7275.35946395844
        }
      ],
      "areaMm2": 31776125.078,
      "confidence": 0.5
    },
    {
      "id": "vlm_room_001",
      "name": "卧室",
      "type": "bedroom",
      "polygon": [
        {
          "x": 3725.6463826814206,
          "y": 3456.38563939085
        },
        {
          "x": 7078.728127094699,
          "y": 3456.38563939085
        },
        {
          "x": 7078.728127094699,
          "y": 8693.174892923314
        },
        {
          "x": 5870.894267864841,
          "y": 8693.174892923314
        },
        {
          "x": 5870.894267864841,
          "y": 7275.35946395844
        },
        {
          "x": 3725.6463826814206,
          "y": 7275.35946395844
        }
      ],
      "areaMm2": 14517816.895,
      "confidence": 0.5
    },
    {
      "id": "vlm_room_004",
      "name": "卧室",
      "type": "bedroom",
      "polygon": [
        {
          "x": 3725.6463826814206,
          "y": 8693.174892923314
        },
        {
          "x": 8196.422041899126,
          "y": 8693.174892923314
        },
        {
          "x": 8196.422041899126,
          "y": 11508.10771539372
        },
        {
          "x": 3725.6463826814206,
          "y": 11508.10771539372
        }
      ],
      "areaMm2": 12584933.145,
      "confidence": 0.5
    },
    {
      "id": "vlm_room_002",
      "name": "卧室",
      "type": "bedroom",
      "polygon": [
        {
          "x": 7078.728127094699,
          "y": 3456.38563939085
        },
        {
          "x": 9790.170772268399,
          "y": 3456.38563939085
        },
        {
          "x": 9790.170772268399,
          "y": 7275.35946395844
        },
        {
          "x": 7078.728127094699,
          "y": 7275.35946395844
        }
      ],
      "areaMm2": 10354928.489,
      "confidence": 0.5
    },
    {
      "id": "vlm_room_007",
      "name": "阳台",
      "type": "balcony",
      "polygon": [
        {
          "x": 7720.367226334277,
          "y": 11508.10771539372
        },
        {
          "x": 11196.043434773233,
          "y": 11508.10771539372
        },
        {
          "x": 11196.043434773233,
          "y": 14116.060183270714
        },
        {
          "x": 7720.367226334277,
          "y": 14116.060183270714
        }
      ],
      "areaMm2": 9064398.345,
      "confidence": 0.5
    },
    {
      "id": "vlm_room_008",
      "name": "厨房",
      "type": "kitchen",
      "polygon": [
        {
          "x": 11229.118895437263,
          "y": 11508.10771539372
        },
        {
          "x": 13495.119119490479,
          "y": 11508.10771539372
        },
        {
          "x": 13495.119119490479,
          "y": 14116.060183270714
        },
        {
          "x": 11229.118895437263,
          "y": 14116.060183270714
        }
      ],
      "areaMm2": 5909620.877,
      "confidence": 0.5
    },
    {
      "id": "vlm_room_000",
      "name": "阳台",
      "type": "balcony",
      "polygon": [
        {
          "x": 9790.170772268399,
          "y": 2563.348201462114
        },
        {
          "x": 13495.119119490479,
          "y": 2563.348201462114
        },
        {
          "x": 13495.119119490479,
          "y": 3969.055279683273
        },
        {
          "x": 9790.170772268399,
          "y": 3969.055279683273
        }
      ],
      "areaMm2": 5208072.116,
      "confidence": 0.5
    },
    {
      "id": "vlm_room_005",
      "name": "卫生间",
      "type": "bathroom",
      "polygon": [
        {
          "x": 8196.422041899126,
          "y": 8693.174892923314
        },
        {
          "x": 9790.170772268399,
          "y": 8693.174892923314
        },
        {
          "x": 9790.170772268399,
          "y": 11508.10771539372
        },
        {
          "x": 8196.422041899126,
          "y": 11508.10771539372
        }
      ],
      "areaMm2": 4486295.612,
      "confidence": 0.5
    },
    {
      "id": "vlm_room_003",
      "name": "卫生间",
      "type": "bathroom",
      "polygon": [
        {
          "x": 3063.3092479825013,
          "y": 7275.35946395844
        },
        {
          "x": 5870.894267864841,
          "y": 7275.35946395844
        },
        {
          "x": 5870.894267864841,
          "y": 8693.174892923314
        },
        {
          "x": 3063.3092479825013,
          "y": 8693.174892923314
        }
      ],
      "areaMm2": 3980637.359,
      "confidence": 0.5
    }
  ],
  "contentHash": "4ffb0137fa5044ae7453a7e320df8250f8c6e5dae48d73d682ada50bf4fc0b1d"
}