{
  "schemaVersion": "0.1.0",
  "projectId": "fp001",
  "layoutRevisionId": "layout_fp001_manual_r2",
  "sourceLayoutHash": "32388ae818d8772ce6cdb0a436bac61459decce9d4703ae0da954c6750aaa52b",
  "rooms": [
    {
      "id": "room_bed_left",
      "name": "卧室",
      "type": "bedroom",
      "polygon": [
        {
          "x": 2950.153846,
          "y": 6218.461538
        },
        {
          "x": -462.769231,
          "y": 6218.461538
        },
        {
          "x": -462.769231,
          "y": 3210.461538
        },
        {
          "x": 0.0,
          "y": 3210.461538
        },
        {
          "x": 2950.153846,
          "y": 3210.461538
        }
      ],
      "areaMm2": 10266072.615,
      "confidence": 0.88
    },
    {
      "id": "room_bed_center",
      "name": "卧室",
      "type": "bedroom",
      "polygon": [
        {
          "x": 2950.153846,
          "y": 6710.153846
        },
        {
          "x": 2950.153846,
          "y": 6218.461538
        },
        {
          "x": 2950.153846,
          "y": 3210.461538
        },
        {
          "x": 5177.230769,
          "y": 3210.461538
        },
        {
          "x": 5177.230769,
          "y": 5697.846154
        },
        {
          "x": 5177.230769,
          "y": 6825.846154
        },
        {
          "x": 4193.846154,
          "y": 6825.846154
        },
        {
          "x": 4193.846154,
          "y": 7259.692308
        },
        {
          "x": 2371.692308,
          "y": 7259.692308
        },
        {
          "x": 2371.692308,
          "y": 6710.153846
        }
      ],
      "areaMm2": 8909197.633,
      "confidence": 0.84
    },
    {
      "id": "room_bath",
      "name": "卫生间",
      "type": "bathroom",
      "polygon": [
        {
          "x": 6739.076923,
          "y": 5697.846154
        },
        {
          "x": 5177.230769,
          "y": 5697.846154
        },
        {
          "x": 5177.230769,
          "y": 3210.461538
        },
        {
          "x": 6739.076923,
          "y": 3210.461538
        },
        {
          "x": 6739.076923,
          "y": 4859.076923
        }
      ],
      "areaMm2": 3884912.095,
      "confidence": 0.8
    },
    {
      "id": "room_kitchen",
      "name": "厨房",
      "type": "kitchen",
      "polygon": [
        {
          "x": 8503.384615,
          "y": 4859.076923
        },
        {
          "x": 6739.076923,
          "y": 4859.076923
        },
        {
          "x": 6739.076923,
          "y": 3210.461538
        },
        {
          "x": 6739.076923,
          "y": 1388.307692
        },
        {
          "x": 8503.384615,
          "y": 1388.307692
        }
      ],
      "areaMm2": 6123504.852,
      "confidence": 0.84
    },
    {
      "id": "room_living_dining",
      "name": "客餐厅",
      "type": "living_dining",
      "polygon": [
        {
          "x": 6739.076923,
          "y": 115.692308
        },
        {
          "x": 6739.076923,
          "y": 1388.307692
        },
        {
          "x": 6739.076923,
          "y": 3210.461538
        },
        {
          "x": 5177.230769,
          "y": 3210.461538
        },
        {
          "x": 2950.153846,
          "y": 3210.461538
        },
        {
          "x": 0.0,
          "y": 3210.461538
        },
        {
          "x": 0.0,
          "y": 115.692308
        }
      ],
      "areaMm2": 20855887.905,
      "confidence": 0.86
    }
  ],
  "contentHash": "edd1f553bc9270fd37228b59c26a80c7cdf3c9ef688b2ea4ff82f9e9962a6d5e"
}
