{
  "schemaVersion": "0.1.0",
  "projectId": "p0-00-three-room-v1",
  "layoutRevisionId": "p0_00_three_room_layout_r1",
  "sourceLayoutHash": "5cd1e75ad02de2add7fb44dfbfa19564beed5b525974f004a68c5c649b638b85",
  "rooms": [
    {
      "id": "vlm_room_006",
      "name": "客餐厅",
      "type": "livingDining",
      "polygon": [
        {
          "x": 9790.170772268399,
          "y": 3969.055279683273
        },
        {
          "x": 13495.119119490479,
          "y": 3969.055279683273
        },
        {
          "x": 13495.119119490479,
          "y": 11508.10771539372
        },
        {
          "x": 9790.170772268399,
          "y": 11508.10771539372
        },
        {
          "x": 9790.170772268399,
          "y": 8693.174892923314
        },
        {
          "x": 7078.728127094699,
          "y": 8693.174892923314
        },
        {
          "x": 7078.728127094699,
          "y": 7275.35946395844
        },
        {
          "x": 9790.170772268399,
          "y": 7275.35946395844
        }
      ],
      "areaMm2": 31776125.078,
      "confidence": 0.5
    }
  ],
  "contentHash": "9c951e3fcfb2004114b5fe767ddc35cdf75f16346b9fc4d2faf68ad32d1b480b"
}